{
  "schema_version":"1.0",
  "comparison_id":"cmp:example",
  "task_id":"TASK-EXAMPLE",
  "plan_id":null,
  "task_class":"small-targeted-patch",
  "status":"PLANNED",
  "created_at":"2026-10-12T00:00:00Z",
  "completed_at":null,
  "baseline":{
    "commit":"0123456789abcdef",
    "task_envelope_sha256":"sha256:task",
    "acceptance_sha256":"sha256:acceptance",
    "verifier_id":"verifier:example",
    "verifier_version":"1",
    "budget_policy_sha256":"sha256:budget"
  },
  "runs":[
    {
      "run_id":"cmp:example:edh",
      "executor":"EDH",
      "status":"PLANNED",
      "worktree":null,
      "run_dir":null,
      "failure_class":null,
      "verifier":{"result":"UNKNOWN","evidence_ref":null},
      "metrics":{
        "elapsed_seconds":{"value":null,"unit":"s","quality":"not_observed","source":null},
        "context_tokens":{"value":null,"unit":"tokens","quality":"not_observed","source":null}
      },
      "artifacts":[]
    },
    {
      "run_id":"cmp:example:rdc",
      "executor":"RDC",
      "status":"PLANNED",
      "worktree":null,
      "run_dir":null,
      "failure_class":null,
      "verifier":{"result":"UNKNOWN","evidence_ref":null},
      "metrics":{
        "elapsed_seconds":{"value":null,"unit":"s","quality":"not_observed","source":null},
        "context_tokens":{"value":null,"unit":"tokens","quality":"not_applicable","source":null}
      },
      "artifacts":[]
    }
  ],
  "comparison":{"winner":null,"decision_policy":null,"notes":"Plan-only fixture; no execution evidence."}
}
